mr,ref
"inform(name[Need for Speed: Shift], developer[Slightly Mad Studios], esrb[E (for Everyone)], genres[driving/racing, simulation], player_perspective[first person, third person], has_multiplayer[yes])",Need for Speed: Shift by Slightly Mad Studios is a driving sim rated E (for Everyone). There's first and third person views and multiplayer.
"inform(name[Tom Clancy's The Division], release_year[2016], rating[average], genres[role-playing, shooter, tactical], platforms[PlayStation, Xbox, PC], available_on_steam[yes], has_linux_release[no], has_mac_release[no])","Tom Clancy's The Division is an average role-playing tactical shooter that came out in 2016 for PlayStation, Xbox and PC. The game is not available on either Mac or Linux, but can be played from Steam."
"inform(name[Life is Strange], rating[good], genres[role-playing], player_perspective[third person])","If you like fun third person role-playing games, then you should try Life is Strange."
"inform(name[World of Warcraft], release_year[2004], genres[adventure, MMORPG], platforms[PC], available_on_steam[no], has_linux_release[no], has_mac_release[yes])","When I think of any adventure game, especially MMORPG, I think World of Warcraft is the way to go. It's been out since 2004 but, unfortunately, it is only available for PC and Mac users. It does not run on Linux systems, and you won't find it on Steam either."
"inform(name[Undertale], release_year[2015], rating[excellent], genres[adventure, indie, role-playing], player_perspective[bird view])",Undertale is an excellent bird view adventure RPG. It is an indie title that was released in 2015.
"inform(name[Bus Driver], esrb[E (for Everyone)], rating[poor], genres[driving/racing, indie, simulation], platforms[PC], available_on_steam[yes], has_linux_release[no], has_mac_release[no])","Bus Driver is a poor indie driving simulation game. The game is rated E (for Everyone) and is for PC only. This game is available on Steam, but not for Mac or Linux."
"inform(name[Assassin's Creed Chronicles: India], release_year[2016], rating[poor], genres[action-adventure, platformer], has_multiplayer[no])","An example of a poorly received action-adventure platformer is Assassin's Creed Chronicles: India. It was made in 2016, and it doesn't have a multiplayer option."
"inform(name[SpellForce 3], developer[Grimlore Games], rating[poor], genres[real-time strategy, role-playing], player_perspective[bird view])","SpellForce 3, developed by Grimlore Games, is a poor role-playing, real-time strategy with bird view perspective."
"inform(name[Warcraft III: Reign of Chaos], developer[Blizzard Entertainment], rating[excellent], genres[real-time strategy], player_perspective[bird view])",Blizzard Entertainment created an excellent real-time strategy game called Warcraft III: Reign of Chaos that also provides bird view.
"inform(name[The Vanishing of Ethan Carter], release_year[2014], esrb[M (for Mature)], rating[average], genres[adventure, indie])",The Vanishing of Ethan Carter from 2014 is rated M. It's an average indie adventure game.
"inform(name[Mafia], release_year[2002], esrb[M (for Mature)], rating[excellent], genres[driving/racing, fighting, shooter], player_perspective[third person])","If you like games with fighting, Mafia is an excellent game that is rated M (for Mature). It is a third person driving/racing shooter from 2002."
"inform(name[Crysis], release_year[2007], genres[action-adventure, shooter], player_perspective[first person], platforms[PlayStation, Xbox, PC], available_on_steam[yes], has_linux_release[no], has_mac_release[no])","Crysis was released in 2007. It's a first person action-adventure shooter game. You can get it for PlayStation, Xbox, and PC, and it's also available on Steam, though Linux and Mac support was dropped."
"inform(name[World of Warcraft: Battle for Azeroth], exp_release_date[August 14, 2018], developer[Blizzard Entertainment], genres[MMORPG], player_perspective[third person], platforms[PC])","Blizzard Entertainment has a new MMORPG coming out August 14, 2018 for PC. It's called World of Warcraft: Battle for Azeroth and is a third person perspective game."
"inform(name[Ori and the Blind Forest], genres[adventure, platformer, puzzle], has_multiplayer[no])",Ori and the Blind Forest is a single-player adventure puzzle platformer.
"inform(name[Mirror's Edge Catalyst], release_year[2016], developer[EA Digital Illusions CE], esrb[T (for Teen)], rating[average], genres[action-adventure, fighting], player_perspective[first person])","Mirror's Edge Catalyst was released in 2016 by EA Digital Illusions CE. It is an okay T-rated action-adventure game that uses fighting style for the platforming gameplay, presented entirely from a first person perspective."
"inform(name[Skyforge], rating[poor], genres[adventure, hack-and-slash, MMORPG], platforms[PlayStation, Xbox, PC], has_linux_release[no], has_mac_release[no])","Skyforge is an adventure hack-and-slash MMORPG that received poor ratings from players. The game is available on PlayStation, Xbox, and PC with no Linux or Mac release."
"inform(name[Portal 2], genres[platformer, puzzle, shooter], player_perspective[first person], platforms[PlayStation, PC], available_on_steam[yes])",Portal 2 is a platforming first person shooter with puzzle elements. It was released on PlayStation and PC and is available on Steam.
"inform(name[Skyforge], developer[Allods Online], rating[poor], genres[adventure, hack-and-slash, MMORPG], platforms[PlayStation, Xbox, PC])","Skyforge is a lackluster adventure hack-and-slash MMORPG by Allods Online. It's available on PlayStation, Xbox and PC."
"inform(name[Metal Gear Solid 3: Snake Eater], release_year[2004], esrb[M (for Mature)], rating[excellent], genres[action-adventure, shooter, tactical], player_perspective[bird view, first person, third person], has_multiplayer[no])","If you like action-adventure tactical shooter games, then you should try the 2004 video game called Metal Gear Solid 3: Snake Eater that uses the first person, third person, and bird view perspectives. Unfortunately, it does not have multiplayer. It has an excellent rating and is rated M (for Mature)."
"inform(name[Might & Magic: Heroes VI], developer[Black Hole Entertainment], rating[average], genres[role-playing, turn-based strategy], platforms[PC], has_linux_release[no], has_mac_release[no])","Might & Magic: Heroes VI by Black Hole Entertainment is a role-playing, turn-based strategy game for PC. It has average ratings and is not supported on Mac or Linux."
"inform(name[Crysis], developer[Crytek Frankfurt], esrb[M (for Mature)], genres[action-adventure, shooter], player_perspective[first person], has_multiplayer[yes])",Crysis is an action-adventure first person shooter by Crytek Frankfurt. This game has an M (for Mature) rating and can be played multiplayer.
"inform(name[Far Cry 3], genres[action-adventure, shooter], platforms[PlayStation, Xbox, PC], available_on_steam[yes], has_linux_release[no], has_mac_release[no])","Far Cry 3 is an action-adventure shooter on PlayStation, Xbox, and PC. It is not supported on Linux or Mac, but it is available on Steam."
"inform(name[Assassin's Creed II], developer[Ubisoft Montreal], esrb[M (for Mature)], rating[good], genres[action-adventure, platformer], has_multiplayer[no])","Assassin's Creed II is a good action-adventure platformer, but does not have a multiplayer. It was developed by Ubisoft Montreal and is rated M (for Mature)."
"inform(name[Spider-Man], exp_release_date[September 7, 2018], genres[action-adventure], player_perspective[third person], platforms[PlayStation])","Spider-Man will be released on September 7, 2018. It's a third person action-adventure game for PlayStation."
"inform(name[Super Bomberman], release_year[1993], rating[average], genres[action, strategy], platforms[Nintendo, PC], available_on_steam[no])",Super Bomberman is considered an average action strategy game for Nintendo and PC that was released in 1993. It is not currently available on Steam.
"inform(name[Heroes of Might and Magic III: The Restoration of Erathia], release_year[1999], rating[good], genres[turn-based strategy], has_multiplayer[yes])",Heroes of Might and Magic III: The Restoration of Erathia is a turn-based strategy game from 1999. It has good ratings and a multiplayer mode.
"inform(name[The Last of Us], developer[Naughty Dog], esrb[M (for Mature)], rating[excellent], genres[action-adventure, shooter], player_perspective[third person], platforms[PlayStation])",The Last of Us is an excellent third person action-adventure shooter by Naughty Dog for the PlayStation console. It's rated M (for Mature).
"inform(name[Horizon: Zero Dawn], release_year[2017], esrb[T (for Teen)], genres[action-adventure, role-playing, shooter], player_perspective[third person], has_multiplayer[no], platforms[PlayStation])","Horizon: Zero Dawn is a role-playing third person shooter game from 2017 with a lot of action and adventure. It is a PlayStation exclusive game with no multiplayer options, and it's suitable for teenagers."
"inform(name[Crysis], release_year[2007], genres[action-adventure, shooter], player_perspective[first person], platforms[PlayStation, Xbox, PC], available_on_steam[yes], has_linux_release[no], has_mac_release[no])","Crysis is an action-adventure first person shooter that was released in 2007 for PlayStation, Xbox, and PC. It's available on Steam, but it doesn't have a Mac or Linux release."
"inform(name[Need for Speed: The Run], release_year[2011], developer[Firebrand Games], genres[driving/racing], player_perspective[first person, third person])",Need for Speed: The Run is a racing game developed by Firebrand Games in 2011. The game offers both first person and third person perspectives.
"inform(name[Super Mario World], release_year[1990], developer[Nintendo EAD], esrb[E (for Everyone)], genres[platformer], player_perspective[side view], has_multiplayer[yes], platforms[Nintendo])",Super Mario World is a 1990 platformer with a side view by Nintendo EAD available for the Nintendo. It has multiplayer and is rated E (for Everyone).
"inform(name[A Way Out], rating[good], genres[action-adventure], player_perspective[third person], platforms[PlayStation, Xbox, PC], available_on_steam[no], has_linux_release[no], has_mac_release[no])","A Way Out is a good third person action-adventure game for PlayStation, Xbox and PC. It's not on Steam, Linux, or Mac."
"inform(name[Football Manager 2015], release_year[2014], developer[Sports Interactive], genres[simulation, sport, strategy])","Football Manager 2015 is a sport-strategy simulator, released in 2014 by Sports Interactive."
"inform(name[Trivial Pursuit], developer[Electronic Arts], rating[poor], genres[trivia/board game], has_multiplayer[yes])","Trivial Pursuit is a trivia/board game developed by Electronic Arts. The game does offer multiplayer, but was received poorly by critics."
"inform(name[MotorStorm: Apocalypse], release_year[2011], esrb[T (for Teen)], genres[vehicular combat])",MotorStorm: Apocalypse is a vehicular combat game from 2011 that is rated T (for Teen).
"inform(name[The Vanishing of Ethan Carter], genres[adventure, indie], has_multiplayer[no])",The Vanishing of Ethan Carter is an indie adventure game with no multiplayer support.
"inform(name[Age of Empires II: The Age of Kings], genres[real-time strategy], player_perspective[bird view], platforms[PlayStation, PC], available_on_steam[no], has_linux_release[no], has_mac_release[yes])","Age of Empires II: The Age of Kings is a real-time, bird view strategy game that can be played on PlayStation or PC. While it's not available on Steam and it doesn't have a Linux release, you can play it on Mac."
"inform(name[Metal Gear Solid 3: Snake Eater], release_year[2004], esrb[M (for Mature)], genres[action-adventure, shooter, tactical], has_multiplayer[no])",Metal Gear Solid 3: Snake Eater is a tactical action-adventure shooter with no multiplayer. It is rated M (for Mature) and was released in 2004.
"inform(name[Far Cry 3], release_year[2012], esrb[M (for Mature)], genres[action-adventure, shooter], player_perspective[first person], has_multiplayer[yes])","Far Cry 3 is a multiplayer action-adventure first person shooter. It is rated M (for Mature), and was released in 2012."
"inform(name[The Legend of Zelda: Ocarina of Time], release_year[1998], developer[Nintendo EAD], esrb[E (for Everyone)], rating[excellent], genres[action-adventure, puzzle, role-playing], player_perspective[bird view, third person], has_multiplayer[no])",There's also The Legend of Zelda: Ocarina of Time (rated E) from 1998. This single-player game was made by Nintendo EAD and is an excellent rated action-adventure puzzle RPG. It's views are bird and third.
"inform(name[Metroid Prime Pinball], release_year[2005], developer[Fuse Games], rating[average], genres[pinball, puzzle], has_multiplayer[yes], platforms[Nintendo])","Metroid Prime Pinball was released by Fuse Games for Nintendo consoles in 2005, and features a puzzle pinball gameplay. It received only average reviews, but it has a multiplayer mode."
"inform(name[Assetto Corsa], release_year[2014], genres[driving/racing, simulation, sport], player_perspective[first person, third person], platforms[PlayStation, Xbox, PC], available_on_steam[yes], has_linux_release[yes], has_mac_release[no])","Assetto Corsa is a first and third person sport racing simulation game from 2014. It runs on PlayStation, Xbox, and PC, and it is available on Steam. It does not have a release for Mac but does for Linux."
"inform(name[Madden NFL 15], developer[EA Tiburon], rating[average], genres[simulation, sport], has_multiplayer[yes], platforms[PlayStation, Xbox])","EA Tiburon made Madden NFL 15 and as you might expect it's your average sports simulator. You can pick it up for the big two, Xbox and PlayStation, and play multiplayer through Xbox Live and the PlayStation Network."
"inform(name[Far Cry 3], genres[action-adventure, shooter], platforms[PlayStation, Xbox, PC], available_on_steam[yes], has_linux_release[no], has_mac_release[no])","Far Cry 3 is an action-adventure shooter game available for the PlayStation, Xbox, and PC, but not Linux or Mac. You can get it on Steam."
"inform(name[The Vanishing of Ethan Carter], release_year[2014], rating[average], genres[adventure, indie])",The Vanishing of Ethan Carter is an average indie adventure game that came out in 2014.
"inform(name[Need for Speed: The Run], release_year[2011], developer[Firebrand Games], esrb[T (for Teen)], rating[average], genres[driving/racing], has_multiplayer[yes])","If you like driving/racing games with multiplayer, Need for Speed: The Run is an average game. It was released in 2011 by Firebrand Games and is rated T (for Teen)."
"inform(name[Battlefield V], exp_release_date[October 16, 2018], genres[action, shooter], player_perspective[first person], platforms[PlayStation, Xbox, PC])","Battlefield V is an upcoming first person action shooter you can play on most platforms including PlayStation, Xbox, and PC. It will be released on October 16, 2018."
"inform(name[Shadow of the Tomb Raider], exp_release_date[September 14, 2018], developer[Eidos Montréal], genres[adventure, shooter], player_perspective[third person], platforms[PlayStation, Xbox, PC])","Shadow of the Tomb Raider is a third person, adventure, shooter game by the developer Eidos Montréal. It will be released on PlayStation, Xbox, and PC. Its expected release date is September 14, 2018."
"inform(name[The Room], developer[Fireproof Games], rating[excellent], genres[indie, point-and-click, puzzle], has_multiplayer[no])",The Room by Fireproof Games is an indie point-and-click single-player puzzle game. It has excellent ratings.
"inform(name[Outlast II], developer[Red Barrels], esrb[M (for Mature)], rating[average], genres[adventure, indie])",Outlast II by Red Barrels is an indie adventure game with average ratings. It is rated M (for Mature.
"inform(name[The Vanishing of Ethan Carter], release_year[2014], genres[adventure, indie], player_perspective[first person], has_multiplayer[no])","If you enjoy indie adventure games with a first person perspective, try The Vanishing of Ethan Carter. It came out in 2014. It doesn't have multiplayer support."
"inform(name[The Vanishing of Ethan Carter], release_year[2014], developer[The Astronauts], rating[average], genres[adventure, indie], player_perspective[first person], has_multiplayer[no])",The Vanishing of Ethan Carter was developed by The Astronauts and released in 2014. It is a first person indie adventure game. This single-player game received an average rating.
"inform(name[NBA 2K16], release_year[2015], genres[sport], player_perspective[third person], platforms[PlayStation, Xbox, PC], has_linux_release[no], has_mac_release[no])","NBA 2K16 is a third person sport game that released in 2015 on PlayStation, Xbox, and PC. It has no Linux or Mac versions."
"inform(name[Commandos: Behind Enemy Lines], esrb[T (for Teen)], genres[strategy, tactical], platforms[PC], available_on_steam[yes])","According to the Entertainment and Ratings Board, the tactical and strategy game Commandos: Behind Enemy Lines, is suitable for Teenagers. It is a PC game which is also available on Steam."
"inform(name[Age of Empires II: The Age of Kings], developer[Ensemble Studios], esrb[T (for Teen)], rating[good], genres[real-time strategy], player_perspective[bird view])","Age of Empires II: The Age of Kings is a good real-time strategy game that has a bird view. Ensemble Studios developed it, and it is rated T (for Teen)."
"inform(name[The Legend of Zelda: Ocarina of Time], esrb[E (for Everyone)], genres[action-adventure, puzzle, role-playing], player_perspective[bird view, third person], has_multiplayer[no], platforms[Nintendo])","The Legend of Zelda: Ocarina of Time is an action-adventure role-playing puzzle game available for Nintendo. The game is played in third person and bird's view and is rated E, but doesn't have multiplayer."
"inform(name[Need for Speed: Payback], release_year[2017], rating[poor], genres[driving/racing], platforms[PlayStation, Xbox, PC], available_on_steam[no], has_linux_release[no], has_mac_release[no])","Need for Speed: Payback is a poor driving/racing game that released in 2017 on PlayStation, Xbox, and PC. It isn't available on Steam and doesn't have a Linux or Mac version."
"inform(name[Need for Speed: Payback], esrb[T (for Teen)], rating[poor], genres[driving/racing], has_multiplayer[yes], platforms[PlayStation, Xbox, PC], has_linux_release[no], has_mac_release[no])","A poor multiplayer driving/racing game is Need For Speed: Payback. It was released on PlayStation and Xbox. It was on PC, too, but not on Mac, nor Linux. It is rated T (for Teen)."
"inform(name[Stronghold 2], rating[average], genres[real-time strategy, simulation])",Stronghold 2 is a real-time strategy and simulation game that has an average rating.
"inform(name[Metal Gear Solid 3: Snake Eater], developer[Konami Computer Entertainment Japan], rating[excellent], genres[action-adventure, shooter, tactical], player_perspective[bird view, first person, third person], has_multiplayer[no], platforms[PlayStation])","An excellent action-adventure tactical shooter for PlayStation is Metal Gear Solid 3: Snake Eater, developed by Konami Computer Entertainment Japan. It allows the player to choose among bird view, and first or third person. It does not have multiplayer."
"inform(name[God of War], release_year[2018], developer[SIE Santa Monica Studio], rating[excellent], genres[action-adventure, platformer, role-playing], player_perspective[third person], has_multiplayer[no], platforms[PlayStation])","God of War is a third person, action-adventure role-playing platformer released on PlayStation in 2018. It was developed by SIE Santa Monica Studio and has excellent ratings. It has no multiplayer."
"inform(name[A Way Out], release_year[2018], esrb[M (for Mature)], genres[action-adventure], platforms[PlayStation, Xbox, PC], available_on_steam[no], has_linux_release[no], has_mac_release[no])","An M-rated action-adventure game released in 2018 is A Way Out. This game is available on PlayStation, Xbox, and PC, but don't excpect it to work on Linux or Mac, nor can you purchase it on Steam."
"inform(name[Horizon: Zero Dawn], release_year[2017], rating[excellent], genres[action-adventure, role-playing, shooter], player_perspective[third person], platforms[PlayStation])",Horizon: Zero Dawn is a third person action-adventure role-playing shooter that released in 2017 as a PlayStation exclusive. The game received excellent reviews from players.
"inform(name[Undertale], rating[excellent], genres[adventure, indie, role-playing], platforms[PlayStation, Nintendo Switch, PC], available_on_steam[yes], has_linux_release[yes], has_mac_release[yes])","Undertale is an excellent indie adventure role-playing game. It is availabe for PlayStation, Nintendo Switch, and PC, and was also released for Steam, Linux, and Mac."
"inform(name[Crysis], release_year[2007], developer[Crytek Frankfurt], rating[good], genres[action-adventure, shooter], player_perspective[first person])",Crysis is a pretty good first person shooter with a lot of action and adventure. It was developed by Crytek Frankfurt in 2007.
"inform(name[Small World 2], rating[poor], genres[indie, trivia/board game], has_multiplayer[yes])",Small World 2 is a poor indie trivia/board game that features multiplayer.
"inform(name[SpellForce 3], release_year[2017], developer[Grimlore Games], genres[real-time strategy, role-playing], player_perspective[bird view], has_multiplayer[yes])","SpellForce 3 is a real-time strategy, role-playing game released by Grimlore Games in 2017. It has a multiplayer mode and bird view player perspective."
"inform(name[Might & Magic: Heroes VI], release_year[2011], rating[average], genres[role-playing, turn-based strategy], player_perspective[bird view], has_multiplayer[yes])","Might & Magic: Heroes VI is a bird view, role-playing turn-based strategy game released in 2011. It has only an average rating, but has multiplayer."
"inform(name[Half-Life 2], release_year[2004], esrb[M (for Mature)], genres[shooter], has_multiplayer[no], platforms[PlayStation, Xbox, PC], has_linux_release[yes], has_mac_release[yes])","Half-Life 2 is an M-rated single-player shooter. It was released in 2004 on PlayStation, Xbox, and PC with both a Linux and Mac release."
"inform(name[Quantum Break], release_year[2016], developer[Remedy Entertainment], rating[average], genres[adventure, shooter], player_perspective[third person])","Quantum Break is considered an average third person shooter, an adventure game developed by Remedy Entertainment and released in 2016."
"inform(name[Tomb Raider: The Angel of Darkness], release_year[2003], genres[action-adventure, shooter], player_perspective[third person], platforms[PlayStation, PC], available_on_steam[yes])",Tomb Raider: The Angel of Darkness is a third person action-adventure shooter from 2003. You can play it on PlayStation or get it on Steam for PC.
"inform(name[Quantum Break], release_year[2016], esrb[M (for Mature)], genres[adventure, shooter])","Quantum Break is an adventure shooter that was released in the year 2016, and is rated M (for Mature)."
"inform(name[Little Big Adventure], release_year[1994], rating[average], genres[action-adventure], has_multiplayer[no])","Little Big Adventure is a decent action-adventure game. Sadly, it is not multiplayer and will be hard to find, since it came out in 1994."
"inform(name[Bus Driver], developer[SCS Software], genres[driving/racing, indie, simulation], has_multiplayer[no], platforms[PC], available_on_steam[yes], has_linux_release[no], has_mac_release[no])",Bus Driver is an indie driving simulator with no multiplayer in it. It was developed by SCS Software for PC and Steam. It has yet to see any Linux or Mac release.
"inform(name[The Crew 2], exp_release_date[June 29, 2018], developer[Ivory Tower], genres[driving/racing], player_perspective[third person], has_multiplayer[yes], platforms[PlayStation, Xbox, PC])","The Crew 2 by Ivory Tower is a multiplayer third person driving/racing game. It is expected to be released for PlayStation, Xbox, and PC on June 29, 2018."
"inform(name[Need for Speed: Payback], release_year[2017], rating[poor], genres[driving/racing], platforms[PlayStation, Xbox, PC], available_on_steam[no], has_linux_release[no], has_mac_release[no])","Need for Speed: Payback is a poorly-rated driving/racing game from 2017. It runs on PlayStation, Xbox, and PC. It is not out on Mac or Linux, and is not on Steam."
"inform(name[NBA 2K16], release_year[2015], rating[good], genres[sport], has_multiplayer[yes], platforms[PlayStation, Xbox, PC], available_on_steam[yes])","NBA 2K16 is a good sport game for the PlayStation, Xbox and PC. It was released in 2015 and is available on Steam. The game features a multiplayer mode."
"inform(name[FIFA 12], release_year[2011], rating[average], genres[simulation, sport], platforms[PlayStation, Xbox, Nintendo, PC], available_on_steam[no], has_linux_release[no], has_mac_release[yes])","FIFA 12 is your average sport simulation game, released in 2011 for the PlayStation, Xbox, Nintendo, and PC. While not available on Steam or Linux, it does have Mac support."
"inform(name[Assetto Corsa], esrb[E (for Everyone)], genres[driving/racing, simulation, sport], platforms[PlayStation, Xbox, PC], has_linux_release[yes], has_mac_release[no])","Assetto Corsa is a sport racing simulator that has been released on PlayStation, Xbox, and PC, including the Linux processor but not the Mac. It is rated E (for Everyone)."
