mr,ref
"inform(name[Might & Magic: Heroes VI], rating[average], genres[role-playing, turn-based strategy], platforms[PC], available_on_steam[yes], has_linux_release[no], has_mac_release[no])","If you're into PC role-playing games with turn-based strategy, look no further than Might & Magic: Heroes VI. Although this particular title isn't available on Linux or Mac, you can find it at the Steam store. People consider this game average, and it has received ratings that reflect that."
"inform(name[Silent Hill 2], developer[Konami Computer Entertainment Tokyo], esrb[M (for Mature)], rating[excellent], genres[action-adventure, puzzle], player_perspective[third person])",Silent Hill 2 is an excellent third person action-adventure puzzle game. The game was developed by Konami Computer Entertainment Tokyo and was rated M (for Mature).
"inform(name[Driver], developer[Reflections Interactive], rating[average], genres[driving/racing, simulation], has_multiplayer[no], platforms[PlayStation, PC], available_on_steam[no])","Driver is a driving simulation game developed by Reflections Interactive which received average reviews. It has no multiplayer, but is available on PlayStation and PC. The game is not available on Steam."
"inform(name[Undertale], developer[tobyfox], rating[excellent], genres[adventure, indie, role-playing])","Undertale is an indie, adventure, role-playing game by the developer tobyfox. It have received overall excellent ratings."
"inform(name[World of Warcraft], release_year[2004], genres[adventure, MMORPG], platforms[PC], available_on_steam[no], has_linux_release[no], has_mac_release[yes])","World of Warcraft is an adventure MMORPG game released in 2004. It's not available on Steam and you can't play on Linux, but you can play it on PC and Mac."
"inform(name[Diablo II], release_year[2000], genres[hack-and-slash, role-playing], has_multiplayer[yes], platforms[PC], available_on_steam[no], has_linux_release[no], has_mac_release[yes])","Diablo II was released in 2000. It is a hack-and-slash role-playing game that has a multiplayer option. The game is available for PC, and was released for Mac, but it is not available on Steam, or for Linux."
"inform(name[NBA 2K16], rating[good], genres[sport], player_perspective[third person], has_multiplayer[yes], platforms[PlayStation, Xbox, PC], available_on_steam[yes])","A good third person sports game with multiplayer is NBA 2k16. It's available on PlayStation or Xbox, or on Steam for PC."
"inform(name[Tom Clancy's Splinter Cell: Chaos Theory], release_year[2005], developer[Ubisoft Montreal], esrb[M (for Mature)], genres[action, tactical], player_perspective[first person, third person], has_multiplayer[yes])","In 2005 Ubisoft Montreal released Tom Clancy's Splinter Cell: Chaos Theory, a multiplayer tactical action game rated M (for Mature). It allows you to switch between first and third person view."
"inform(name[Mafia], release_year[2002], developer[Illusion Softworks], rating[excellent], genres[driving/racing, fighting, shooter], player_perspective[third person])","If you are looking for a shooter game that also has driving, racing and fighting you'll enjoy 2002's Mafia. You'll play in third person and the game has an excellent rating which is a solid nod to its developer Illusion Softworks."
"inform(name[BioShock], release_year[2007], developer[2K Boston], genres[action-adventure, role-playing, shooter])","In 2007, 2K Boston released BioShock. It is an action-adventure role-playing shooter game."
"inform(name[Super Bomberman], release_year[1993], developer[Hudson Soft], genres[action, strategy])",Super Bomberman was released by Hudson Soft in 1993 and is an action strategy game.
"inform(name[Mafia], release_year[2002], developer[Illusion Softworks], esrb[M (for Mature)], rating[excellent], genres[driving/racing, fighting, shooter], player_perspective[third person], has_multiplayer[no])","If you want to try an awesome shooting and driving game, you should check out Mafia, by Illusion Softworks, which also includes some fighting elements. You can only play it single-player, but you can switch to the third person perspective. It is an M-rated game from 2002."
"inform(name[Far Cry 3], developer[Ubisoft Massive], genres[action-adventure, shooter], player_perspective[first person])",Far Cry 3 is an action-adventure shooter from an entirely first person perspective. It's under the care of Ubisoft Massive.
"inform(name[Tomb Raider: The Angel of Darkness], release_year[2003], esrb[T (for Teen)], genres[action-adventure, shooter], player_perspective[third person])",Tomb Raider: The Angel of Darkness is a third person action-adventure shooter from 2003. It has a T (for Teen) rating.
"inform(name[Uncharted 4: A Thief's End], release_year[2016], developer[Naughty Dog], rating[excellent], genres[action-adventure, shooter], player_perspective[third person], platforms[PlayStation])","Uncharted 4: A Thief's End, by Naughty Dog came out 2016 with excellent ratings. It's an action-adventure third person shooter game exclusively for the PlayStation platform."
"inform(name[Quantum Break], release_year[2016], developer[Remedy Entertainment], rating[average], genres[adventure, shooter], player_perspective[third person])",Quantum Break by Remedy Entertainment in 2016 is a third person adventure shooter with average ratings.
"inform(name[Need for Speed: Most Wanted], genres[driving/racing], player_perspective[first person, third person], has_multiplayer[yes], platforms[PlayStation, Xbox, Nintendo, PC], available_on_steam[no], has_linux_release[no], has_mac_release[no])","If you're in the market for a driving or racing game to play with your friends, Need for Speed: Most Wanted is a game to buy. It is available for the following platforms: PlayStation, Xbox, Nintendo and PC, although you will neither find it on Steam, nor on Mac or Linux systems. In the game, you can switch between first and third person view."
"recommend(name[The Forest of Doom], has_mac_release[yes])",Ever heard of The Forest of Doom on Mac?
"recommend(name[Outlast II], genres[adventure, indie], player_perspective[first person])",Are you familiar with Outlast II? It's this great first person indie adventure game.
"recommend(name[Stronghold 2], developer[Firefly Studios], platforms[PC])","One of my favorite PC games made by Firefly Studios is Stronghold 2, are you familiar with it?"
"recommend(name[Age of Empires II: The Age of Kings], release_year[1999], developer[Ensemble Studios])","Speaking of games from 1999, have you ever heard of the Ensemble Studios game Age of Empires II: The Age of Kings?"
"recommend(name[Assetto Corsa], developer[Kunos Simulazioni], player_perspective[first person])","While we're on the subject of first person games made by Kunos Simulazioni, have you ever played Assetto Corsa?"
"recommend(name[The Forest of Doom], platforms[PC])","Speaking of great PC games, have you heard of The Forest of Doom?"
"recommend(name[Super Mario World], genres[platformer], player_perspective[side view])","If you're after a side scrolling platformer, Super Mario World is a fun game. Have you ever played it before?"
"recommend(name[Resident Evil 4], genres[action-adventure, shooter], platforms[Nintendo])","A fun action-adventure shooter for Nintendo is Resident Evil 4, have you heard of it?"
"recommend(name[Uncharted 4: A Thief's End], genres[action-adventure, shooter], player_perspective[third person])","When it comes to third person action-adventure shooters, Uncharted 4: A Thief's End is a pretty famous one. Have you played it before?"
"recommend(name[Resident Evil 4], genres[action-adventure, shooter], platforms[Nintendo])",Have you ever tried the Nintendo action-adventure shooting game Resident Evil 4?
"recommend(name[Age of Empires II: The Age of Kings], developer[Ensemble Studios], esrb[T (for Teen)])","Speaking of T (for Teen) games from Ensemble Studios, have you heard of Age of Empires II: The Age of Kings?"
"recommend(name[The Wolf Among Us], release_year[2013], genres[adventure, point-and-click])","Since I know you like point-and-click games, have you tried the 2013 adventure game The Wolf Among Us?"
"recommend(name[Uncharted 4: A Thief's End], genres[action-adventure, shooter], player_perspective[third person])",If you're into third person action-adventure shooters then I'd recommend Uncharted 4: A Thief's End. Have you played it?
"recommend(name[Sid Meier's Civilization V], has_mac_release[yes])","I know there's not many Mac games out there, but a solid one is Sid Meier's Civilization V. Have you played it, by any chance?"
"recommend(name[The Wolf Among Us], developer[Telltale Games], genres[adventure, point-and-click])","So, speaking of point-and-click adventure games released by Telltale Games, have you heard of The Wolf Among Us?"
"recommend(name[Need for Speed: Most Wanted], release_year[2005], genres[driving/racing])","A 2005 driving/racing game I thought was fun was Need for Speed: Most Wanted, are you familiar with it?"
"recommend(name[The Wolf Among Us], has_multiplayer[no], platforms[PC])","One of my favorite single-player PC games is The Wolf Among Us, do you know about it?"
"recommend(name[NBA 2K16], developer[Visual Concepts])",I know Visual Concepts is one of your favorite developers. Have you tried NBA 2K16 yet?
"recommend(name[RollerCoaster Tycoon], developer[MicroProse], platforms[PC])",One of the all time classic PC games released by MicroProse was RollerCoaster Tycoon. Do you know of it?
"recommend(name[Age of Empires II: The Age of Kings], release_year[1999], developer[Ensemble Studios])","Speaking of 1999 releases from Ensemble Studios, have you heard of Age of Empires II: The Age of Kings?"
"recommend(name[The Witcher 3: Wild Hunt], genres[action-adventure, role-playing], player_perspective[third person])","Since you like action-adventure games from a third person perspective with role-playing elements, you should try this game I like, The Witcher 3: Wild Hunt?"
"recommend(name[Undertale], developer[tobyfox], player_perspective[bird view])",Have you heard of Undertale? It's this bird view game from tobyfox.
"recommend(name[Portal 2], release_year[2011], player_perspective[first person])",A first person game released back in 2011 that I enjoyed was Portal 2. Have you played it before?
"recommend(name[Never Alone], platforms[PlayStation])","Since you like PlayStation games, have you given Never Alone a try?"
"recommend(name[Age of Empires II: The Age of Kings], developer[Ensemble Studios], platforms[PlayStation])","Speaking of PlayStation games from Ensemble Studios, have you heard of Age of Empires II: The Age of Kings?"
"recommend(name[Worms: Reloaded], esrb[E 10+ (for Everyone 10 and Older)], platforms[PC])","If you're looking for an E 10+ rated game you can play on the PC, there's always Worms: Reloaded. Have you heard of it before?"
"recommend(name[Portal 2], developer[Valve Corporation], platforms[PlayStation])",I know you're a fan of the Valve Corporation. Have you played Portal 2 on PlayStation?
"recommend(name[Resident Evil 4], esrb[M (for Mature)], has_multiplayer[no])",One of my favorite single-player games that got an M rating was Resident Evil 4. Have you ever played it?
"recommend(name[Resident Evil 4], developer[Capcom Production Studio 4], platforms[Nintendo])","While we're on the subject of games that Capcom Production Studio 4 made for Nintendo, have you heard of Resident Evil 4?"
"recommend(name[Sid Meier's Civilization V], developer[Firaxis Games])","Hey, I know Firaxis Games night not have the strongest reputation, but Sid Meier's Civilization V is worth a try. Have you checked it out?"
"recommend(name[Portal 2], developer[Valve Corporation], platforms[PlayStation])","Speaking of PlayStation games made by Valve Corporation, have you ever played Portal 2?"
"recommend(name[Uncharted 4: A Thief's End], player_perspective[third person], platforms[PlayStation])","Speaking of third person PlayStation games, are you familiar with Uncharted 4: A Thief's End?"
"recommend(name[Worms: Reloaded], has_linux_release[yes], has_mac_release[yes])","Speaking of strategy games suitable for Mac and Linux platform, have you heard of Worms: Reloaded?"
"recommend(name[Super Mario World], developer[Nintendo EAD], has_multiplayer[yes])","Since you seem to be a fan of multiplayer games by Nintendo EAD, I thought you might like Super Mario World too. Have you heard about this game?"
"recommend(name[NBA 2K16], available_on_steam[yes])","Speaking of Steam games, have you got NBA 2K16 yet?"
"recommend(name[The Forest of Doom], available_on_steam[yes])","Since you're fond of games on Steam, have you heard of The Forest of Doom?"
"recommend(name[The Legend of Zelda: Ocarina of Time], release_year[1998], platforms[Nintendo])","Wait, you haven't played The Legend of Zelda: Ocarina of Time? Dude it's been out since 1998, I will literally lend you my copy and my Nintendo 64, you have to play it."
"recommend(name[Resident Evil 4], release_year[2005], player_perspective[third person])",A good third person game I played from back in 2005 was Resident Evil 4. Have you ever played it before?
"recommend(name[Stronghold 2], developer[Firefly Studios], platforms[PC])","Since you typically like PC games, you'd love Firefly Studios' Stronghold 2. Heard of it?"
"recommend(name[Madden NFL 15], player_perspective[third person])","If I remember correctly, you're into third person games. Have you played Madden NFL 15 by any chance?"
"recommend(name[The Witcher 3: Wild Hunt], has_multiplayer[no], platforms[Xbox])","Hmm, a good single-player game for the Xbox, you say? Have you heard of The Witcher 3: Wild Hunt?"
"recommend(name[The Forest of Doom], has_mac_release[yes])","If you like Mac games, you should give The Forest of Doom a try. Have you heard of it before?"
"recommend(name[Assetto Corsa], genres[driving/racing, simulation, sport], player_perspective[first person])","While we're on the subject of first person driving/racing sport simulators, have you ever heard of Assetto Corsa?"
"recommend(name[Need for Speed: The Run], esrb[T (for Teen)])",Have you played Need for Speed: The Run? I think your mom would be OK with it since it's rated T (for Teen).
"recommend(name[Need for Speed: Most Wanted], esrb[T (for Teen)], player_perspective[first person])","Since you mostly play teen rated games, and that preferably from the first person perspective, I wonder if you've tried Need for Speed: Most Wanted."
"recommend(name[The Wolf Among Us], available_on_steam[yes])","I know you use Steam a lot, so I wonder if you've tried The Wolf Among Us."
"recommend(name[The Wolf Among Us], esrb[M (for Mature)], platforms[PC])","I know you enjoy M rated games you can play on your PC, have you heard of The Wolf Among Us?"
"recommend(name[NBA 2K16], has_multiplayer[yes])","If you're into multiplayer games, you should pick up NBA 2K16. Has anyone mentioned this game to you before?"
"recommend(name[The Wolf Among Us], platforms[PC])",I was looking for a new PC game and thought I'd ask you if you've ever heard of The Wolf Among Us?
"recommend(name[Stronghold 2], has_multiplayer[yes], platforms[PC])","If you're looking for a PC game with multiplayer, Stronghold 2 is an option. Are you familiar with it?"
"recommend(name[Tony Hawk's Pro Skater 3], genres[sport], player_perspective[third person])","If we're talking about third person sport games, you really can't go wrong with Tony Hawk's Pro Skater 3. Have you ever played it?"
"recommend(name[Resident Evil 4], esrb[M (for Mature)], has_multiplayer[no])","Since you like M rated single-player games, then you'd love Resident Evil 4. Have you given that a whirl?"
"recommend(name[NBA 2K16], player_perspective[third person])","Speaking of third person games, have you tried NBA 2K16?"
"recommend(name[Madden NFL 15], developer[EA Tiburon])","So while we're talking about games by EA Tiburon, have you played Madden NFL 15?"
"recommend(name[The Wolf Among Us], has_multiplayer[no], platforms[PC])","Speaking of single-player games suitable on PC, have you heard of The Wolf Among Us?"
"recommend(name[Assetto Corsa], has_multiplayer[yes], platforms[PC])","One multiplayer PC game I'm fond of is Assetto Corsa, have you tried it out?"
"recommend(name[The Witcher 3: Wild Hunt], player_perspective[third person])","Speaking of third person perspective games, have you tried The Witcher 3: Wild Hunt?"
"recommend(name[Portal 2], developer[Valve Corporation], has_multiplayer[yes])",My favorite multiplayer game from Valve Corporation is actually Portal 2. Are you familiar with it?
"recommend(name[NBA 2K16], player_perspective[third person])","Since you're into third person games, I bet you'd love NBA 2K16. Do you know anything about it?"
"recommend(name[Call of Duty: Advanced Warfare], developer[Sledgehammer Games], has_multiplayer[yes])","Have you heard of Call of Duty: Advanced Warfare? Sledgehammer Games made it, it's a pretty fun multiplayer game."
"recommend(name[Super Bomberman], esrb[E (for Everyone)], platforms[PC])","If you're looking for a good family-friendly game for the PC, Super Bomberman has an E rating. Have you heard of it before?"
"recommend(name[RollerCoaster Tycoon], genres[simulation, strategy], platforms[PC])","A strategy simulator for the PC that I enjoyed is RollerCoaster Tycoon, have you ever played it?"
"recommend(name[F1 2014], genres[driving/racing, simulation, sport], player_perspective[third person])",A third person driving/racing sport simulator I enjoyed was F1 2014. Have you played it before?
request(specifier[poorly balanced]),What do you think is the most poorly balanced game you've ever played?
request(specifier[calming]),Can you think of any calming video games?
"request(release_year[2005], specifier[underrated])",What do you think is the most underrated game that was released in 2005?
request(specifier[surprising]),Did you find any games really surprising when you first tried them?
"request(release_year[2001], specifier[broken])",What's a game you know of from 2001 that was just plain broken?
"request(has_multiplayer[yes], specifier[dull])",Have you played a multiplayer game recently that was totally dull?
"request(esrb[M (for Mature)], specifier[tearjerking])",Have you ever played an M rated game that was tearjerking?
"request(release_year[2014], specifier[terrible])",Were there even any terrible games in 2014?
request(specifier[worst looking]),What is the worst looking video game you ever encountered?
"request(player_perspective[first person], specifier[absorbing])",Can you recommend to me an absorbing first person game?
request(specifier[oldest]),What's the oldest game you like?
request(specifier[worst looking]),What do you think is the worst looking video game that you know of?
"request(player_perspective[first person], specifier[absorbing])",Have you played any first person perspective games lately that you would say are really absorbing?
"request(platforms[PlayStation], specifier[stunning])",Do you know of a PlayStation game that has really stunning graphics?
"request(platforms[PlayStation], specifier[relaxing])",Are there any games you like to play on PlayStation that are relaxing?
request(specifier[realistic]),Is there a game you can think of that you'd say is very realistic?
request(specifier[cheap]),Have you played any cheap games that you enjoyed?
"request(esrb[E 10+ (for Everyone 10 and Older)], specifier[frightening])",Are there any E 10+ rated frightening games?
"request(genres[shooter], specifier[confusing])",What do you think is the most confusing shooter ever made?
request(specifier[uninteresting]),What do you think is the most uninteresting video game you ever encountered?
request(specifier[limiting]),What game have you played with a limiting storyline?
request(specifier[visually impressive]),Can you suggest a really visually impressive game?
"request(esrb[M (for Mature)], specifier[gritty])",What's your favorite gritty rated M game?
"request(platforms[PlayStation], specifier[revolting])",Was there ever a PlayStation game you encountered that you felt was just revolting?
request(specifier[quick-to-learn]),Can you suggest a quick-to-learn game?
request(specifier[unfair]),Have you ever played a video game that just felt plain unfair?
"request(developer[Bloober Team], specifier[silliest])",What do you think is the silliest game ever made by Bloober Team?
request(specifier[rewarding]),Is their a video game you know of that felt very rewarding to play?
"request(release_year[2013], specifier[longest])","Of the games released in 2013, which do you think was the longest?"
request(specifier[first]),What was the first game you played this year?
"request(genres[role-playing, text adventure], specifier[shortest])",What's the shortest role-playing text adventure game you know of?
"request(has_linux_release[no], specifier[cheap])",Have you played any cheap games lately that don't have a Linux release?
"request(genres[real-time strategy, simulation], specifier[other])",What other real-time strategy simulator have you played?
"request(genres[driving/racing], specifier[complicated])",What would you say is a good example of a complicated driving/racing game?
"request(has_multiplayer[no], specifier[epic])",Can you recommend any single-player games with epic storylines?
request(specifier[annoying]),Have you played a game lately that you found annoying?
request(specifier[scary]),Have you ever played a game that you found scary?
"request(has_multiplayer[no], specifier[epic])",What's the most epic single-player game that you played recently?
request(specifier[surprising]),What's a game whose quality you found surprising?
request(specifier[last]),What's the last video game you played?
request(specifier[newest]),What's the newest game that you've played lately?
request(specifier[last]),What's the last video game you finished?
"request(available_on_steam[yes], specifier[challenging])",Are there any challenging games you like that are on Steam?
request(specifier[thrilling]),Are there any games you find really thrilling?
"request(player_perspective[first person], specifier[oldest])",What's the oldest game with a first person perspective that you ever played?
"request(developer[Overkill Software], specifier[empowering])",What do you think is a good example of an empowering game developed by Overkill Software?
request(specifier[nostalgic]),Is there a game that makes you feel nostalgic?
request(specifier[unusual]),Are there any unusual games you would recommend?
"request(genres[adventure, indie], specifier[short])",Do you know any short indie adventure games I could pick up?
"request(genres[action-adventure, role-playing, shooter], specifier[gory])","What's a really gory role playing action-adventure shooter? I'm looking for blood, you know?"
"request(developer[Neversoft Entertainment], specifier[other])",What other game developed by Neversoft Entertainment have you played?
request(specifier[realistic]),What's a good realistic game?
"request(player_perspective[first person], specifier[exhilarating])","I'm looking for a game from a first person perspective that is really exhilarating, is there one you would recommend to me?"
request(specifier[upcoming]),Are there any upcoming games you're interested in?
"request(genres[role-playing, text adventure], specifier[shortest])",What's the shortest RPG text adventure you know of? I'm looking for something quick.
"request(release_year[2014], specifier[terrible])",What's a truly terrible game released in 2014 that you know of?
request(specifier[last]),What is the last game you played?
"request(genres[action, platformer, strategy], specifier[fun])",Have you played any fun action strategy platformers lately?
request(specifier[addictive]),Are there any games you find really addictive?
"request(platforms[Xbox], specifier[easiest])",What's the easiest game you've played on the Xbox?
"request(developer[Hazelight Studios], specifier[classic])",Did Hazelight Studios make any classic games?
request(specifier[oldest]),What's the oldest video game you ever played?
request(specifier[annoying]),Have you ever played a game that you just found annoying?
"request(player_perspective[third person], specifier[dynamic])",What's your favorite dynamic third person game?
request(specifier[short]),What's a nice short game I could play tonight?
"request(has_multiplayer[yes], specifier[addictive])",Have you ever encountered a multiplayer game that was truly addictive?
request_attribute(esrb[]),What is your favorite ESRB content rating?
request_attribute(genres[]),What video game genre is the best in your opinion?
request_attribute(developer[]),Who is your favorite game developer?
request_attribute(platforms[]),What's your favorite platform for games?
request_attribute(available_on_steam[]),Are games that are available on Steam more likely to make it into your game library?
request_attribute(esrb[]),"If the ESRB rating of a game matters to you, which one do you normally go with?"
request_attribute(esrb[]),Do you generally look at the ESRB content rating of a game before playing it?
request_attribute(platforms[]),Which platform is your choice for gaming?
request_attribute(has_mac_release[]),Do you play video games on the Mac OS?
request_attribute(release_year[]),Do you have a favorite release year for video games?
request_attribute(has_mac_release[]),Do you use Mac as a platform for your gaming?
request_attribute(has_linux_release[]),Does it matter to you if you can play a game on a Linux OS?
request_attribute(has_linux_release[]),Do you play games on Linux at all?
request_attribute(has_multiplayer[]),"Do you enjoy playing games in multiplayer, with other people?"
request_attribute(has_mac_release[]),Do you think Mac is a better gaming platform than others?
request_attribute(release_year[]),Which year do you think was the best for games?
request_attribute(esrb[]),Is there a particular ESRB content rating a game must have for you to even consider it?
