mr,ref
"inform(name[Super Bomberman], release_year[1993], genres[action, strategy], has_multiplayer[no], platforms[Nintendo, PC], available_on_steam[no], has_linux_release[no], has_mac_release[no])","Super Bomberman is this single-player Nintendo game from 1993 full of action and strategy. You can also play on PC, however, you can't get it on Steam, nor Linux or Mac."
"inform(name[Bus Driver], esrb[E (for Everyone)], rating[poor], genres[driving/racing, indie, simulation], platforms[PC], available_on_steam[yes], has_linux_release[no], has_mac_release[no])","Bus Driver is a poor indie driving simulation game. The game is rated E (for Everyone) and is for PC only. This game is available on Steam, but not for Mac or Linux."
"inform(name[Need for Speed: Payback], release_year[2017], rating[poor], genres[driving/racing], platforms[PlayStation, Xbox, PC], available_on_steam[no], has_linux_release[no], has_mac_release[no])","Need for Speed: Payback is a poorly-rated driving/racing game from 2017. It runs on PlayStation, Xbox, and PC. It is not out on Mac or Linux, and is not on Steam."
"inform(name[Uncharted 4: A Thief's End], release_year[2016], developer[Naughty Dog], rating[excellent], genres[action-adventure, shooter], player_perspective[third person], has_multiplayer[yes], platforms[PlayStation])",Naughty Dog released Uncharted 4: A Thief's End for the PlayStation in 2016. It's an excellent third person shooter action-adventure game with multiplayer.
"inform(name[Tony Hawk's Pro Skater 3], developer[Neversoft Entertainment], genres[sport], platforms[PlayStation, Xbox, Nintendo, PC], available_on_steam[no], has_linux_release[no], has_mac_release[yes])","I recently played the sports game Tony Hawk's Pro Skater 3. It was made by the developer Neversoft Entertainment for PlayStation, Xbox, Nintendo, as well as PC via Steam. It was not released for Linux, but it has a Mac support."
"inform(name[Bus Driver], esrb[E (for Everyone)], rating[poor], genres[driving/racing, indie, simulation], platforms[PC], available_on_steam[yes], has_linux_release[no], has_mac_release[no])","Bus Driver is an indie driving simulation with overall negative ratings. It is rated E (for Everyone), and is available on PC, as well as Steam. However, it does not run on Mac or Linux."
"inform(name[RollerCoaster Tycoon], developer[MicroProse], genres[simulation, strategy], player_perspective[bird view], platforms[Xbox, PC], has_linux_release[yes], has_mac_release[no])","RollerCoaster Tycoon is a simulation strategy game by MicroProse. The game offers a bird view and is on Xbox and PC, including Linux systems, however, with no Mac support."
"inform(name[Outlast II], rating[average], genres[adventure, indie], platforms[PlayStation, Xbox, Nintendo Switch, PC], has_linux_release[no], has_mac_release[yes])","If you're looking for an indie adventure game, try Outlast II. It has received average ratings, and you can play it on PlayStation, Xbox, Nintendo Switch or PC. Though it doesn't have a Linux release, you can play it on Mac as well."
"inform(name[Little Big Adventure], release_year[1994], rating[average], genres[action-adventure], platforms[PlayStation, PC], available_on_steam[yes], has_linux_release[no], has_mac_release[yes])","Little Big Adventure is an average-rated 1994 action-adventure game. It's available on PlayStation, PC, and Mac, but not Linux. You can buy it on Steam."
"inform(name[Transport Tycoon], release_year[1994], rating[average], genres[simulation, strategy])",Transport Tycoon is an average simulation strategy game released in 1994.
"inform(name[Dance Dance Revolution Universe 3], developer[Konami], esrb[E (for Everyone)], rating[poor], genres[music], platforms[Xbox])",Dance Dance Revolution Universe 3 is a poorly rated music game. It is rated E (for Everyone). It was made by Konami and runs on Xbox only.
"inform(name[Dance Dance Revolution Universe 3], release_year[2008], developer[Konami], esrb[E (for Everyone)], rating[poor], genres[music], platforms[Xbox])","Dance Dance Revolution Universe 3 is a 2008 Xbox music game released by Konami. It is rated E (for Everyone), but it has poor ratings."
"inform(name[Never Alone], rating[average], genres[adventure, indie, platformer], player_perspective[side view])",Never Alone is an indie adventure platformer with average ratings. It is played side view.
"inform(name[Mirror's Edge Catalyst], developer[EA Digital Illusions CE], genres[action-adventure, fighting])",Mirror's Edge Catalyst is an action-adventure fighting game by EA Digital Illusions CE.
"inform(name[Little Big Adventure], release_year[1994], esrb[T (for Teen)], rating[average], genres[action-adventure], player_perspective[third person], has_multiplayer[no])","The action-adventure game from 1994, Little Big Adventure, was rated T (for Teen). This game is played from a third person view, has no multiplayer, and received only average ratings."
"inform(name[Little Nightmares], release_year[2017], rating[good], genres[adventure, platformer, puzzle], player_perspective[side view], has_multiplayer[no])","A good puzzle adventure platformer with side view perspective is Little Nightmares, which came out in 2017. It does not have multiplayer."
"inform(name[Need for Speed: Shift], rating[average], genres[driving/racing, simulation], player_perspective[first person, third person])",Need for Speed: Shift is a driving/racing simulation game that most people considered to be average. One of the cool features is the ability to switch from first person to third person perspective while you play.
"inform(name[Tom Clancy's Splinter Cell: Chaos Theory], release_year[2005], rating[good], genres[action, tactical], player_perspective[first person, third person])",Tom Clancy's Splinter Cell: Chaos Theory is a good action-tactical game released in 2005. The game allows the player to switch between first person and third person perspectives.
"inform(name[MotorStorm: Apocalypse], genres[vehicular combat], platforms[PlayStation])",MotorStorm: Apocalypse is a vehicular combat game exclusively for PlayStation.
"inform(name[Worms: Reloaded], genres[action, platformer, strategy], platforms[PC], has_linux_release[yes], has_mac_release[yes])",Worms: Reloaded is an action platformer game for PC. The strategy game is available on Linux and Mac as well.
"inform(name[Mafia], release_year[2002], esrb[M (for Mature)], rating[excellent], genres[driving/racing, fighting, shooter], player_perspective[third person])",Mafia is an excellent driving/racing and fighting third person shooter that was out in 2002 with an M (for Mature) rating.
"inform(name[World of Warcraft], release_year[2004], developer[Blizzard Entertainment], genres[adventure, MMORPG], player_perspective[third person])",World of Warcraft by Blizzard Entertainment was released in 2004. It's an adventure MMORPG that is played in the third person.
"inform(name[FIFA 12], release_year[2011], esrb[E (for Everyone)], rating[average], genres[simulation, sport], player_perspective[bird view, side view])",FIFA 12 is an average sport simulation that is rated E (for Everyone). This game came out in 2011 and has a bird view or side view perspective.
"inform(name[Silent Hill 2], esrb[M (for Mature)], genres[action-adventure, puzzle])",Silent Hill 2 is an action-adventure puzzle game. It is rated M (for Mature).
"inform(name[Lara Croft and the Temple of Osiris], genres[action-adventure, puzzle, shooter], platforms[PlayStation, Xbox, PC], has_linux_release[no], has_mac_release[no])","Lara Croft and the Temple of Osiris is an action-adventure, puzzle shooter game. It's available for PlayStation, Xbox, and PC, but was not released for Linux or Mac."
"inform(name[Horizon: Zero Dawn], release_year[2017], esrb[T (for Teen)], genres[action-adventure, role-playing, shooter], player_perspective[third person], has_multiplayer[no], platforms[PlayStation])","Horizon: Zero Dawn is a role-playing third person shooter game from 2017 with a lot of action and adventure. It is a PlayStation exclusive game with no multiplayer options, and it's suitable for teenagers."
"inform(name[Need for Speed: Payback], release_year[2017], genres[driving/racing], player_perspective[third person], has_multiplayer[yes], platforms[PlayStation, Xbox, PC], has_linux_release[no], has_mac_release[no])","Need for Speed: Payback is a third person driving/racing game with a multiplayer mode. It came out in 2017 for PlayStation, Xbox, and PC, but it is not available on Mac or Linux."
"inform(name[MotorStorm: Apocalypse], release_year[2011], genres[vehicular combat], player_perspective[third person], has_multiplayer[yes], platforms[PlayStation])","MotorStorm: Apocalypse was released in the year 2011 on the PlayStation only. It's a vehicular combat game through the third person perspective, and it has multiplayer mode."
"inform(name[The Elder Scrolls V: Skyrim], esrb[M (for Mature)], rating[good], genres[adventure, role-playing])",One of the good adventure role-playing games I recently played is The Elder Scrolls V: Skyrim. The game is restricted to mature audiences only.
"inform(name[The Last of Us], developer[Naughty Dog], esrb[M (for Mature)], rating[excellent], genres[action-adventure, shooter], player_perspective[third person], has_multiplayer[yes], platforms[PlayStation])","The Last of Us is an action-adventure shooter on PlayStation. Developed by Naughty Dog, it's rated M (for Mature). With a third person perspective and multiplayer options, it has earned excellent ratings."
"inform(name[Transport Tycoon], release_year[1994], developer[Chris Sawyer], genres[simulation, strategy], player_perspective[bird view])","Transport Tycoon, by developer Chris Sawyer, is a simulation strategy game from a bird view perspective. It was released in 1994."
"inform(name[Nightshade], release_year[2017], genres[text adventure])",Nightshade is a text adventure game that came out in 2017.
"inform(name[Need for Speed: Payback], esrb[T (for Teen)], rating[poor], genres[driving/racing], has_multiplayer[yes], platforms[PlayStation, Xbox, PC], has_linux_release[no], has_mac_release[no])","The PlayStation and Xbox game, Need for Speed: Payback, is a suitable game for teenagers, as it offers driving/racing multiplayer features. While the game is not an option for Linux or Mac users, it is available for PC despite the poor ratings."
"inform(name[MotorStorm: Apocalypse], release_year[2011], developer[Evolution Studios], esrb[T (for Teen)], rating[poor], genres[vehicular combat], player_perspective[third person], platforms[PlayStation])",MotorStorm: Apocalypse is a poorly reviewed 2011 game. It is a third person vehicular combat game that was made for PlayStation. It was developed by Evolution Studios and was rated T.
"inform(name[NHL 15], esrb[E 10+ (for Everyone 10 and Older)], rating[average], genres[simulation, sport], player_perspective[bird view])",NHL 15 was released with an E 10+ (for Everyone 10 and Older) rating. It's an average simulation sport game that is played from a bird view.
"inform(name[MotorStorm: Apocalypse], release_year[2011], developer[Evolution Studios], esrb[T (for Teen)], rating[poor], genres[vehicular combat], player_perspective[third person], platforms[PlayStation])","MotorStorm: Apocalypse was developed by Evolution Studios, and was released in 2011 with a rating of T (for Teen). It's a poor third person vehicular combat game for PlayStation."
"inform(name[The Sims], esrb[T (for Teen)], rating[good], genres[simulation, strategy], player_perspective[bird view], has_multiplayer[no])","The Sims is a simulation strategy game that gives the player a bird view perspective. It has good likability and is rated T (for Teen). There is no multiplayer, however."
"inform(name[Age of Wonders II: The Wizard's Throne], release_year[2002], genres[role-playing, turn-based strategy], platforms[PC], has_linux_release[no], has_mac_release[no])","Age of Wonders II: The Wizard's Throne is a role-playing turn-based strategy that was released for PC only, but does not have a Linux or Mac release. It was released in 2002."
"inform(name[Nightshade], developer[Red Entertainment Corporation], genres[text adventure], platforms[PC], available_on_steam[yes], has_linux_release[no], has_mac_release[no])","Red Entertainment Corporation developed Nightshade, a text adventure game for PC only. It is available on Steam, but there is no Linux or Mac release."
"inform(name[Tetris], genres[arcade, puzzle, strategy], player_perspective[side view])",Tetris is a side view arcade puzzle and strategy game.
"inform(name[Little Big Adventure], release_year[1994], esrb[T (for Teen)], rating[average], genres[action-adventure], player_perspective[third person], has_multiplayer[no])",Little Big Adventure is an average third person action-adventure game released in 1994. It is rated T (for Teen) and does not feature multiplayer.
"inform(name[World of Warcraft: Battle for Azeroth], exp_release_date[August 14, 2018], genres[MMORPG], platforms[PC])","World of Warcraft: Battle for Azeroth is an MMORPG game and is expected to be released on August 14, 2018. It will be available exclusively on PC."
"inform(name[FIFA 12], rating[average], genres[simulation, sport], platforms[PlayStation, Xbox, Nintendo, PC], has_linux_release[no], has_mac_release[yes])","FIFA 12 is a sport simulation game with average ratings. It is on PlayStation, Xbox, Nintendo, and PC. It is supported by Mac, but it is not on Linux."
"inform(name[Little Big Adventure], release_year[1994], genres[action-adventure], player_perspective[third person])",Little Big Adventure is a third person action-adventure game released in 1994.
"inform(name[NBA 2K16], release_year[2015], rating[good], genres[sport], has_multiplayer[yes], platforms[PlayStation, Xbox, PC], available_on_steam[yes])","NBA 2k16 was released in 2015 with good reviews. The sport game is available on PlayStation and Xbox consoles, and on PC through the Steam store. This game also has a multiplayer mode available."
"inform(name[World of Warcraft], release_year[2004], rating[good], genres[adventure, MMORPG], player_perspective[third person], platforms[PC], available_on_steam[no])",World of Warcraft is an adventure massively multiplayer online role-playing game released in 2004 by Blizzard Entertainment. The third person MMORPG with good ratings is available for PC on Blizzard's launcher with no release on Steam.
"inform(name[Mafia], release_year[2002], developer[Illusion Softworks], esrb[M (for Mature)], rating[excellent], genres[driving/racing, fighting, shooter], player_perspective[third person])",Mafia is an excellent driving and fighting third person shooter. It was released in 2002 with an M rating and was developed by Illusion Softworks.
"inform(name[Uncharted 4: A Thief's End], release_year[2016], rating[excellent], genres[action-adventure, shooter], player_perspective[third person], platforms[PlayStation])","If you have a PlayStation, I have an action-adventure third person shooter that you cannot pass up. With its excellent rating, Uncharted 4: A Thief's End is a must-play-now if you haven't played it since it was released in 2016."
"inform(name[Metroid Prime Pinball], release_year[2005], esrb[E (for Everyone)], rating[average], genres[pinball, puzzle], has_multiplayer[yes], platforms[Nintendo])",The 2005 Nintendo title Metroid Prime Pinball is a decent title rated E (for Everyone). The pinball puzzler boasts multiplayer mode.
"inform(name[MotorStorm: Apocalypse], release_year[2011], esrb[T (for Teen)], genres[vehicular combat])",MotorStorm: Apocalypse is a vehicular combat game from 2011 that is rated T (for Teen).
"inform(name[Rocket League], release_year[2015], esrb[E (for Everyone)], genres[sport, vehicular combat], has_multiplayer[yes])","If you're looking for a game that's rated E (for Everyone), the multiplayer game, Rocket League, will have you playing with your family for hours. It's a vehicular combat sports game from 2015."
"inform(name[The Vanishing of Ethan Carter], esrb[M (for Mature)], rating[average], genres[adventure, indie])",The Vanishing of Ethan Carter is an average indie adventure game that was rated M (for Mature).
"inform(name[Nightshade], release_year[2017], genres[text adventure], platforms[PC], has_linux_release[no], has_mac_release[no])",Nightshade is a text adventure game released in 2017 for PC only. It is not on Linux or Mac.
"inform(name[The Wolf Among Us], genres[adventure, point-and-click], platforms[PlayStation, Xbox, PC], has_linux_release[no], has_mac_release[yes])","The Wolf Among us is an adventure game only available on PlayStation, Xbox and PC. The point-and-click game is not available on Linux but is available on the Mac."
"inform(name[Stronghold 2], release_year[2005], genres[real-time strategy, simulation], has_multiplayer[yes])",Stronghold 2 is a real-time strategy simulation game released in 2005 with multiplayer support.
"inform(name[Resident Evil 4], esrb[M (for Mature)], genres[action-adventure, shooter], platforms[PlayStation, Xbox, Nintendo, PC], available_on_steam[yes], has_linux_release[no], has_mac_release[no])","Rated M (for Mature), Resident Evil 4 is an action-adventure shooter jam packed full of thrilling moments. Available on the PlayStation, Xbox, Nintendo, and the PC platforms (through Steam), but has no Mac or Linux release in sight."
"inform(name[Need for Speed: The Run], esrb[T (for Teen)], genres[driving/racing], player_perspective[first person, third person])",Need for Speed: The Run was released with a T (for Teen) rating. It is a driving/racing game that offers a first person and third person mode.
"inform(name[Silent Hill 2], release_year[2001], genres[action-adventure, puzzle], player_perspective[third person], has_multiplayer[no])","If you like single-player action-adventure puzzle games with third person view, try Silent Hill 2. It was released in 2001."
"inform(name[The Vanishing of Ethan Carter], release_year[2014], esrb[M (for Mature)], rating[average], genres[adventure, indie])","The Vanishing of Ethan Carter was mostly just okay. It's your average indie-adventure title that came out in 2014. Be aware it's not a children's game, and has an M-rating."
"inform(name[Tony Hawk's Pro Skater 3], release_year[2001], developer[Neversoft Entertainment], esrb[T (for Teen)], rating[average], genres[sport], player_perspective[third person])",Tony Hawk's Pro Skater 3 by Neversoft Entertainment was an average sport game. It was released in 2001 is rated T. It has a third person perspective.
"inform(name[Ori and the Blind Forest], genres[adventure, platformer, puzzle], has_multiplayer[no])","If you want an adventure puzzle platformer with no multiplayer, try Ori and the Blind Forest."
"inform(name[The Sims], genres[simulation, strategy], has_multiplayer[no], platforms[PlayStation, Xbox, Nintendo, PC], available_on_steam[no])","The sims is a simulation, strategy game. The game does not offer a multiplayer mode. It is available for PlayStation, Xbox, Nintendo, and PC, but you can't get it on Steam."
"inform(name[Super Mario World], release_year[1990], genres[platformer], player_perspective[side view], has_multiplayer[yes])",Super Mario World is a 1990 side view multiplayer platformer.
"inform(name[Portal 2], release_year[2011], genres[platformer, puzzle, shooter], player_perspective[first person])",It's hard to believe Portal 2 came out all the way back in 2011. It really redefined the first person platforming puzzle shooter genre.
"inform(name[Metro 2033], rating[good], genres[action, role-playing, shooter], player_perspective[first person], has_multiplayer[no])","I've heard about Metro 2033 recently, an action first person shooter with good ratings, where you get to role-play too. It's single-player, which is no problem for me."
"inform(name[Diablo II], release_year[2000], rating[good], genres[hack-and-slash, role-playing], has_multiplayer[yes], platforms[PC], has_linux_release[no], has_mac_release[yes])","A good hack-and-slash, role-playing game is Diablo II released in 2000. It has a multiplayer mode. It came out on PC and Mac but not on Linux."
"inform(name[Alan Wake's American Nightmare], release_year[2012], esrb[T (for Teen)], rating[poor], genres[action-adventure, shooter], player_perspective[third person])",Alan Wake's American Nightmare was released in 2012 with a T (for Teen) rating. It is rated poor. It is a third person action-adventure shooter game.
"inform(name[Lara Croft and the Temple of Osiris], rating[average], genres[action-adventure, puzzle, shooter], player_perspective[bird view])",Lara Croft and the Temple of Osiris is an average action-adventure puzzle game. The shooter is played in the bird view.
"inform(name[Mirror's Edge Catalyst], developer[EA Digital Illusions CE], genres[action-adventure, fighting], platforms[PlayStation, Xbox, PC], available_on_steam[no], has_linux_release[yes], has_mac_release[no])","EA Digital Illusions CE made Mirror's Edge Catalyst, and action-adventure fighting game, for both PlayStation and Xbox. If you have a PC, you can play it too, but unfortunately not on Steam. The game is not available for Mac users, but it has a Linux release."
"inform(name[RollerCoaster Tycoon], developer[MicroProse], genres[simulation, strategy], player_perspective[bird view], platforms[Xbox, PC], has_linux_release[yes], has_mac_release[no])","RollerCoaster Tycoon is a simulation strategy game with a bird's eye view for the player. It was developed by Microprose for Xbox and PC and also has a Linux release, though not one for Mac as well."
"inform(name[The Elder Scrolls Online], release_year[2014], developer[ZeniMax Online Studios], genres[MMORPG])","The Elder Scrolls Online, released in 2014, is an MMORPG developed by ZeniMax Online Studios."
"inform(name[TrackMania Turbo], release_year[2016], rating[good], genres[arcade, driving/racing], platforms[PlayStation, Xbox, PC], available_on_steam[yes])","TrackMania Turbo is a 2016 arcade racing game. It is rated good and is available on PlayStation, Xbox, and PC and is also available on Steam."
"inform(name[Max Payne], esrb[M (for Mature)], genres[action-adventure, shooter], player_perspective[third person])",Max Payne is a third person action-adventure shooter game. It's rated M.
"inform(name[Trivial Pursuit], release_year[2009], rating[poor], genres[trivia/board game], platforms[PlayStation, Nintendo])",Trivial Pursuit is a poor trivia/board game which was released in 2009. You can play it on PlayStation or Nintendo.
"inform(name[Commandos: Behind Enemy Lines], release_year[1998], esrb[T (for Teen)], genres[strategy, tactical], has_multiplayer[yes])",Commandos: Behind Enemy Lines is a 1998 tactical game that involves strategy. The game offers multiplayer and is rated T (for Teen).
"inform(name[MotorStorm: Apocalypse], release_year[2011], genres[vehicular combat], player_perspective[third person], has_multiplayer[yes], platforms[PlayStation])","If you have a PlayStation and enjoy vehicular combat games that you can play mutiplayer with friends, you should try MotorStorm: Apocalypse. The game came out in 2011 and is played with third person perspective."
"inform(name[Ori and the Blind Forest], developer[Moon Studios], rating[excellent], genres[adventure, platformer, puzzle], has_multiplayer[no])","Ori and the Blind Forest by Moon Studios is a single-player adventure, puzzle platformer. It has excellent ratings."
"inform(name[Small World 2], release_year[2010], developer[Days of Wonder], genres[indie, trivia/board game], has_multiplayer[yes])",Small World 2 is an indie trivia/board game that was developed by Days Of Wonder in 2010. It's a multiplayer game.
"inform(name[Euro Truck Simulator], release_year[2008], rating[poor], genres[driving/racing, simulation], player_perspective[first person], platforms[PC], available_on_steam[yes])","Euro Truck Simulator is a poor driving simulator from a first person perspective. The game came out in 2008, and is only available on PC. You can, of course, get it on Steam."
"inform(name[Might & Magic: Heroes VI], release_year[2011], genres[role-playing, turn-based strategy], platforms[PC], has_linux_release[no], has_mac_release[no])","Might & Magic: Heroes VI was released for the PC in 2011, but not for Linux or Mac. It's a role-playing turn-based strategy game."
"inform(name[Mirror's Edge Catalyst], release_year[2016], developer[EA Digital Illusions CE], esrb[T (for Teen)], rating[average], genres[action-adventure, fighting], player_perspective[first person])",Mirror's Edge Catalyst by EA Digital Illusions CE is from 2016. It is an average action-adventure fighting game rated T (for Teen) and has first person view.
"inform(name[Skyforge], rating[poor], genres[adventure, hack-and-slash, MMORPG], player_perspective[third person], platforms[PlayStation, Xbox, PC], has_linux_release[no], has_mac_release[no])","Skyforge is a poor third person hack-and-slash adventure MMORPG. The game was released for PlayStation, Xbox and PC, but does not have a Linux or Mac release."
"inform(name[Mafia], release_year[2002], esrb[M (for Mature)], rating[excellent], genres[driving/racing, fighting, shooter], player_perspective[third person])","In 2002 an excellent game called Mafia was released. It is a third person shooting, fighting and driving game. It is an adult game that's rated M (for Mature)."
"inform(name[Ori and the Blind Forest], release_year[2015], genres[adventure, platformer, puzzle], platforms[Xbox, PC], available_on_steam[yes], has_linux_release[no], has_mac_release[no])","The 2015 game Ori and the Blind Forest is an adventure puzzle platformer. It can be played on Xbox and your PC. It isn't available on Linux or Mac, but it was released on Steam."
